{
  "$schema": "http://json-schema.org/draft-07/schema#",
  "title": "Loops UI config",
  "type": "object",
  "required": ["vault", "stakeholder", "self", "priorityCaps"],
  "properties": {
    "vault": {
      "type": "object",
      "properties": {
        "scanFolders": {
          "type": "array",
          "items": { "type": "string" },
          "description": "Folders at the vault root to scan for `- [ ]` checkbox loops."
        },
        "inboxFile": { "type": "string", "description": "Path (relative to vault root) where manual loops get appended." },
        "adoptedFile": { "type": "string" },
        "closeOutsFile": { "type": "string" }
      }
    },
    "stakeholder": {
      "type": "object",
      "description": "The primary stakeholder. Drives the P1 capacity bucket, the weekly summary, and the pLevel tag (e.g. `P1:Boss`).",
      "properties": {
        "name": { "type": "string", "description": "Display name shown in the UI. e.g. 'Boss', 'Manager', or a person's first name." },
        "tag": { "type": "string", "description": "Tag used in pLevel strings. Typically same as name, no spaces." },
        "capacityMax": { "type": "number", "description": "Max active P1:<tag> loops before the capacity gate fires." },
        "weeklySummary": { "type": "boolean", "description": "Whether to render the StakeholderUpdateCard (weekly draft)." },
        "staleDays": { "type": "number", "description": "Loops with this tag untouched for N days raise a flag on the weekly draft." }
      }
    },
    "self": {
      "type": "object",
      "properties": {
        "capacityMax": { "type": "number", "description": "Max active P1:self loops before the capacity gate fires." }
      }
    },
    "priorityCaps": {
      "type": "object",
      "properties": {
        "P1Flat": { "type": "number" },
        "P2Flat": { "type": "number" }
      }
    },
    "scannerStakeholders": {
      "type": "array",
      "description": "Additional names the vault scanner should detect in task text and tag as P3:<Name>. Lowercase keyword → display name.",
      "items": {
        "type": "object",
        "required": ["keyword", "name"],
        "properties": {
          "keyword": { "type": "string" },
          "name": { "type": "string" }
        }
      }
    },
    "subgroupHints": {
      "type": "array",
      "description": "Subgroup-name substring → work-mode hint for classification fallback.",
      "items": {
        "type": "object",
        "required": ["match", "mode"],
        "properties": {
          "match": { "type": "string" },
          "mode": { "enum": ["build", "design", "communicate", "research", "ops"] }
        }
      }
    }
  }
}
